{
  "object": "artefact",
  "name": "facilities",
  "description": "facilities team",
  "detailedDescription": "You press your face to the glass and squint.<br>Is there anyone there?",
  "attributes": {
    "type": "scenery",
    "subType": "intangible"
  },
  "synonyms": [
    "team",
    "facilities team"
  ]
}