{
  "object": "artefact",
  "name": "plate",
  "description": "plate",
  "detailedDescription": "It's a standard white mass-produced dinner plate",
  "attributes": {
    "extendedInventoryDescription": "There's $inventory on it.",
    "weight": 0.25,
    "carryWeight": 0.2,
    "type": "container",
    "imageName": "dinnerplate.jpg", 
    "canCollect": true,
    "isBreakable": true,
    "affinityModifier": 0
  },
  "synonyms": [
    "white plate"
  ]
}