{
"object": "artefact",
"name": "chairs",
"description": "set of office chairs",
"detailedDescription": "They're just standard office chairs.",
"attributes": {
    "defaultAction": "rest",
    "weight": 30,
    "type": "bed",
    "imageName": "officechairs.jpg", 
    "isBreakable": true,
    "plural": true,
    "customAction": [
    "get"
    ],
    "defaultResult": "It's best to leave them here."
},
"synonyms": [
  "chair",
  "office chair",
  "standard office chair"
]
}