{
"object": "artefact",
"name": "batteries",
"description": "torch batteries",
"detailedDescription": "They're pretty chunky but fairly old-looking.",
"attributes": {
    "weight": 1,
    "canCollect": true,
    "imageName": "batteries.jpg", 
    "charges": 45,
    "chargeUnit": "minute",
    "chargesDescription": "There's enough for about $charges $chargeUnit of power",
    "plural": true,
    "affinityModifier": 0,
    "componentOf": [
    "torch"
    ]
},
"synonyms": [
    "battery",
    "torch batteries"
]
}